index,ref,jp_content,jp_hint,ch_content
075,#14L5,こんなひどい*状態(じょうたい)*でボランティアの*場所(ばしょ)*へ*行(い)く*と、*仕事場(しごとば)*の*人(ひと)*に*迷惑(めいわく)*をかけてしまうことがだいたい*想像(そうぞう)*できました。,～ひどい*状態(じょうたい)*で～、～*迷惑(めいわく)*をかけてしまう～。,若在這種極差的狀態下前往志工的地點的話，大致上能夠想像會給工作地點的人造成困擾。（過去式）
076,#14L6,もし*皆(みんな)*が*速(はや)い*スピードで*喋(しゃべ)ったら*、*全然(ぜんぜん)**理解(りかい)でき*なくて、*面白(おもしろ)*そうな*事(こと)*は、*私(わたし)*にとって*寂(さび)しい**事(こと)*になってしまいました。,（這題直接看參考解答比較快XD）,如果大家用很快的速度講話，因為完全無法理解，感覺很有趣的事情對我來說會變得空虛。
077,#14L8,*幸(さいわ)い*、*会(あ)った**人(ひと)*は*全員(ぜんいん)**優(やさ)しかった*し、*私(わたし)*にゆっくり*話(はな)し*、*気(き)*を*使(つか)って*くれました。,*幸(さいわ)い*、～し、～し、～。,幸好，我遇到的人全部人都很好，也會放慢速度對我說話，很照顧我。
078,#14L13,*楽(たの)しい**事(こと)*が*沢山(たくさん)*できてたから、*苦(くる)しい**思(おも)い**出(で)*を*忘(わす)れ*ようと*思(おも)い*ます。*日本(にほん)*へ*行(い)って*、*親切(しんせつ)な**方々(かたがた)*に*出会(であ)えて**本当(ほんとう)に**良(よ)かった*です。,～できてたから、～ようと*思(おも)い*ます。～。,因為有發生許多開心的事，所以我打算忘卻痛苦的回憶。能夠前往日本和親切的各位相遇實在是很美好。
079,#12L8,*私(わたし)*は*数(かぞ)え**切(き)れ*ないくらい*何度(なんど)*も*何度(なんど)*も*転(ころ)び*ました。,～*切(き)れ*ない～。,我數都數不清地滾了好幾次。
080,#13L12,*厚塗(あつぬ)り*では、レイヤーの*使用数(しようすう)*が*少(すく)ない*から、*慣(な)れ*ないと*修正(しゅうせい)*に*時間(じかん)*がかかるので、*難(むずか)しい**塗(ぬ)り**方(かた)*と*言(い)え*ます。,（這題直接看參考解答比較快XD）,至於厚塗，由於圖層的使用數量較少，如果不熟悉的話為了修正會比較費時，因此可說是比較難的上色法。
081,#13L17,デジタルイラストの*塗(ぬ)り**方(かた)*はまだ*沢山(たくさん)*あるんですけど、*残念(ざんねん)*ながら、*紙数(しすう)*に*限(かぎ)り*がありますので、もし*次(つぎ)*の*機会(きかい)*があればまた*紹介(しょうかい)し*たいと*思(おも)い*ます。,（這題直接看參考解答比較快XD）,電繪上色法雖然還有很多種，但很遺憾由於頁數上有所限制，我想下次如果有機會的話再（向大家）介紹。
082,,とんでもございません。,（嗚嗚我雖然很想給你提示，但…）,不敢當。（您過獎了。）
083,,- *少(すこ)し*しかできません。<br>- このくらいしかできません。<br>- これしかできません。,～しかできません。,- 只會一點點。<br>- 只會這種程度而已。<br>- 只會這些。
